Name,Slug,Collection ID,Item ID,Archived,Draft,Created On,Updated On,Published On,Date,PDF,Content,Thumbnail,Author,Gallery
June 2024 Newsletter,june-2024-newsletter,65e60b49424066470c920d78,6660ce9b8587d4f6a1a71a09,false,false,Wed Jun 05 2024 20:46:19 GMT+0000 (Coordinated Universal Time),Thu Jul 17 2025 14:23:40 GMT+0000 (Coordinated Universal Time),Thu Jul 17 2025 15:41:20 GMT+0000 (Coordinated Universal Time),Sat Jun 01 2024 00:00:00 GMT+0000 (Coordinated Universal Time),https://cdn.prod.website-files.com/637e82335616ba47c774e6bc/6660cdd63330567a868f64dc_June24%20Newsletter.pdf,"<p id="""">Get ready to dive into a month filled with sunshine, laughter, and exciting events here at the Gardens on Quail! As the days grow longer and warmer, we're thrilled to bring you a lineup of activities and celebrations that are sure to make your summer unforgettable. From our vibrant Health Fair and enchanting Summer Orchestra night to Father's Day festivities and our special Alzheimer's Awareness event, there's something for everyone to enjoy.</p><p id=""""> So grab your sun hats, bring your smiles, and let's make June a month to remember!</p><h3 id="""">Upcoming Events</h3><p id=""""><strong id="""">June 9th: Summer Orchestra</strong></p><ul id=""""><li id=""""><strong id="""">Time:</strong> 6:30 pm</li><li id="""">Enjoy an evening of beautiful music performed by a local orchestra.</li></ul><p id=""""><strong id="""">June 12th: The Gardens on Quail Health Fair</strong></p><ul id=""""><li id=""""><strong id="""">Time:</strong> 1:00 pm - 3:00 pm</li><li id="""">Join us at the town center to meet our fantastic ancillary and caring partners.</li></ul><p id=""""><strong id="""">June 14th: Father's Day Car Show with Burgers and Brews</strong></p><ul id=""""><li id=""""><strong id="""">Time:</strong> 10:00 am - 1:00 pm</li><li id="""">Celebrate Father's Day with classic cars, delicious burgers, and refreshing brews.</li></ul><p id=""""><strong id="""">June 16th: Donuts with Dads</strong></p><ul id=""""><li id=""""><strong id="""">Time:</strong> 10:30 am</li><li id="""">Join us for a special Father's Day treat. Happy Father's Day!</li></ul><p id=""""><strong id="""">June 20th: Longest Day of the Year - Alzheimer's Awareness Event</strong></p><ul id=""""><li id=""""><strong id="""">Time:</strong> 6:00 pm</li><li id="""">Celebrate the longest day of the year with a drive-in movie and a Purple Party to raise awareness for Alzheimer's.</li></ul><h3 id="""">Resident Birthdays</h3><ul id=""""><li id=""""><strong id="""">June 1st:</strong> Joan Simms</li><li id=""""><strong id="""">June 4th:</strong> Bobby Smith</li><li id=""""><strong id="""">June 6th:</strong> Hue Norwood</li><li id=""""><strong id="""">June 10th:</strong> Carol Foster</li><li id=""""><strong id="""">June 14th:</strong> Martha Lillibridge</li><li id=""""><strong id="""">June 27th:</strong> Monica Norwood</li><li id=""""><strong id="""">June 28th:</strong> Barbara Biallas</li><li id=""""><strong id="""">June 30th:</strong> Della Dickerson</li></ul><h3 id="""">Staff Birthdays</h3><ul id=""""><li id=""""><strong id="""">June 7th:</strong> Mary Cagle</li><li id=""""><strong id="""">June 8th:</strong> Barry Borden and Victoria Hack</li><li id=""""><strong id="""">June 20th:</strong> Mia Garcia</li><li id=""""><strong id="""">June 22nd:</strong> Vanessa Valdez</li><li id=""""><strong id="""">June 24th:</strong> Cheryl Briscoe-Jones</li></ul><h3 id="""">Dementia Support Group</h3><p id=""""><strong id="""">Date:</strong> June 11th</p><p id="""">‍<strong id="""">Time:</strong> 4:00 pm</p><p id="""">Led by Regional <a href=""/team/marci-gerke"" id="""">Memory Care Director Marci Gerke</a>, this support group is open to anyone caring for aging loved ones, especially those with dementia. Join us for support, information, and a welcoming environment to share experiences.</p><h3 id="""">Welcome New Residents</h3><p id="""">A warm welcome to our newest community members: Suzanne Boudeur, Elizabeth Morgan, Larry and Ren McKenize, Sandra Webber, and Marilyn Funk.</p><h3 id=""""><a href=""/volunteering"" id="""">Volunteering Opportunities</a></h3><p id="""">We're seeking volunteers to assist with activities, showcase musical talents, or simply spend quality time with our residents. If interested, please contact Jennie at <a id="""">jdreiling@gardensonquail.com</a>.</p><h3 id="""">Garden Club</h3><p id="""">Our veggie patch is officially in the ground! Join Jess every Tuesday at 11:15 am for some garden magic. Help us keep our garden thriving with watering, weeding, planting, and harvesting.</p><h3 id="""">Al Fresco Dining</h3><p id="""">Summer is the perfect time to enjoy a meal outside. If you'd like to dine in our beautiful courtyard, let a server know before you go out, and we'll ensure you're taken care of.</p><p id="""">Enjoy the sunny days and warm nights this June at Gardens on Quail. We're looking forward to all the wonderful moments we'll share together this month!</p><p id="""">‍</p>",https://cdn.prod.website-files.com/637e82335616ba47c774e6bc/6660ce2cdd0805f82899a760_june24-screenshot-ezgif.com-resize.avif,mariah-ruell,https://cdn.prod.website-files.com/637e82335616ba47c774e6bc/6660d67a2ee15090b1605528_8.avif; https://cdn.prod.website-files.com/637e82335616ba47c774e6bc/6660d67ae2616c5966be26c7_7.avif; https://cdn.prod.website-files.com/637e82335616ba47c774e6bc/6660d67abda27db5433c73f0_6.avif; https://cdn.prod.website-files.com/637e82335616ba47c774e6bc/6660d67abfc9b07b9990f641_5.avif; https://cdn.prod.website-files.com/637e82335616ba47c774e6bc/6660d67ac4696042b73ec46a_3.avif; https://cdn.prod.website-files.com/637e82335616ba47c774e6bc/6660d67a652169e45ede8d76_2.avif; https://cdn.prod.website-files.com/637e82335616ba47c774e6bc/6660d67ab7b3fb4038fedab2_1.avif
June 25 Newsletter,june-25-newsletter,65e60b49424066470c920d78,684084e493127bc5dfa785f9,false,false,Wed Jun 04 2025 17:39:48 GMT+0000 (Coordinated Universal Time),Thu Jul 17 2025 14:20:58 GMT+0000 (Coordinated Universal Time),Thu Jul 17 2025 15:41:20 GMT+0000 (Coordinated Universal Time),Sun Jun 01 2025 00:00:00 GMT+0000 (Coordinated Universal Time),https://cdn.prod.website-files.com/637e82335616ba47c774e6bc/684084ec51f557cbfe567426_June%202025%20Newsletter.pdf,"<p id="""">At the Gardens on Quail, June is more than just the start of summer—it's a season of celebration, creativity, and community. We're thrilled to invite residents, families, and friends to take part in a vibrant array of events that capture the spirit of togetherness and joy.</p><p id=""""><strong id="""">🌎 June 5 – World Environment Day</strong><br>We're going green by painting recycling bins that will be placed in each neighborhood. This creative act promotes sustainability while letting residents leave their artistic mark.</p><p id=""""><strong id="""">🍦 Every Sunday at 3 PM – Ice Cream Socials</strong><br>Join us in the Town Center for sweet treats, good company, and summer vibes.</p><p id=""""><strong id="""">🚗 June 14 – Father’s Day Car Show (10 AM – 1 PM)</strong><br>Celebrate our Gardens Fathers with chrome, classics, and camaraderie. A community favorite!</p><p id=""""><strong id="""">🧑🏽‍🌾 Weekend Gardening Fun</strong><br>Every Saturday and Sunday, residents can nurture our beautiful grounds by helping water the gardens—a wonderful way to connect with nature.</p><p id=""""><strong id="""">🧵 June 19 – Juneteenth Celebration</strong><br>We’ll create a large paper quilt made from individual squares crafted by residents. Wear red in honor of the holiday and join us in reflecting on freedom and history.</p><p id=""""><strong id="""">🌈 June 29 – Pride Day</strong><br>Show your colors and support love in all its forms! Dress in rainbow attire and celebrate unity with us.</p><p id=""""><strong id="""">🎨 June 12 – Tie-Dye Workshop (11 AM – 4 PM)</strong><br>Peace, love, and color! Our courtyard will come alive with vibrant creations that will be sold at the Craft Fair.</p><p id=""""><strong id="""">🛍️ June 21 – Walk to End Alzheimer’s Craft Fair</strong><br>Support a meaningful cause while shopping handmade crafts by residents and local vendors in our Town Center. All proceeds from resident crafts will benefit the Walk to End Alzheimer’s.</p><p id=""""><strong id="""">🍨 June 27 – Dignity Hospice Ice Cream Social (2 PM)</strong><br>A sweet way to say thank you and celebrate community.</p><p id=""""><strong id="""">🍴 Tasty Tuesdays</strong><br>June 3 – Rice Krispies Creations<br>June 24 – Banana Bread Baking Fun</p><p id=""""><strong id="""">🎶 Friday Happy Hours (3 PM)</strong><br>Enjoy live music, delicious bites, and refreshing drinks every week!</p><ul id=""""><li>June 6: Rick Chinisci &amp; Charlie Duo</li><li>June 13: Dino on Drums</li><li>June 20: Bill Sucke Encore</li><li>June 27: Calvin the Hat Man</li></ul><p id=""""><strong id="""">🎉 Celebrating Our Own</strong><br>Happy Birthday to all our June babies—residents and staff alike! And a huge congratulations to our Employee of the Month, Sammi Niemeier. Your warmth and culinary creativity make every meal memorable.</p><p id="""">This June, the Gardens on Quail is the place to be—where every event is another reason to smile, connect, and thrive.</p><p>‍</p>",https://cdn.prod.website-files.com/637e82335616ba47c774e6bc/684084eff2574304c93919ce_thumbnail.webp,mariah-ruell,https://cdn.prod.website-files.com/637e82335616ba47c774e6bc/684084f5daf1b40a351f501a_1.webp; https://cdn.prod.website-files.com/637e82335616ba47c774e6bc/684084f56a2d0b8be646ce18_2.webp; https://cdn.prod.website-files.com/637e82335616ba47c774e6bc/684084f573eb383ccb40f31c_3.webp
March 2024 Newsletter,march-2024-newsletter,65e60b49424066470c920d78,65e60eb62e270e440454b324,false,false,Mon Mar 04 2024 18:11:02 GMT+0000 (Coordinated Universal Time),Thu Jul 17 2025 14:25:18 GMT+0000 (Coordinated Universal Time),Thu Jul 17 2025 15:41:20 GMT+0000 (Coordinated Universal Time),Fri Mar 01 2024 00:00:00 GMT+0000 (Coordinated Universal Time),https://cdn.prod.website-files.com/637e82335616ba47c774e6bc/65e60b97174985515e11c7ee_24March%20Newsletter.pdf,"<h2 id=""""><strong id="""">Spring is in the air, and Gardens on Quail is buzzing with excitement! </strong></h2><p id=""""><strong id="""">This March, we're celebrating community, creativity, and the joys of the season. From our Pie Bake-Off winners to a lineup of exciting events, there's something for everyone to enjoy. Join us in making this month unforgettable with festive parties, creative activities, and heartfelt gatherings. Let's celebrate together!</strong></p><p id=""""><strong id="""">Pie Bake-Off Winners Announced!</strong></p><p id=""""><strong id="""">‍</strong>A round of applause for our culinary artists in the Cinnamon neighborhood for winning with their Lemon Cream Pie. Thanks to our judges from Dignity Hospice, Shamrock Foods, EmpowerMe, and GTI Labs.</p><p id=""""><strong id="""">Exciting March Events: Join Us!</strong></p><ul id=""""><li id=""""><strong id="""">Oscar Party:</strong> Glam up for our Oscar Party on March 10th at 5:00 pm.</li><li id=""""><strong id="""">Memory Care Outing:</strong> Join us for lunch at Randy's on March 14th at 11:00 am.</li><li id=""""><strong id="""">New Resident Lunch-In:</strong> Welcome our new neighbors on March 14th at 12:00 pm.</li><li id=""""><strong id="""">St. Patrick's Day Party:</strong> Get festive on March 17th at 2:45 pm.</li><li id=""""><strong id="""">Paint and Sip:</strong> Unleash creativity with Tracey's Traveling Art on March 24th at 1:30 pm.</li><li id=""""><strong id="""">Easter Service:</strong> Celebrate with us on March 31st at 10:30 am.</li></ul><p id=""""><strong id="""">Celebrating Our Beloved Residents and Staff</strong></p><ul id=""""><li id=""""><strong id="""">Resident Birthdays:</strong> Cheers to Cindy Ewing, Bill Koller, Dino DeVovellis, Dottie Eccher, Wally McDonald, Thresa Kautz, and Bill Netz.</li><li id=""""><strong id="""">Staff Birthdays:</strong> Celebrating Annette Little, Melissa Escobar, Trynadee Wilson, Josh Kavinsky, and Ebelia Arroyo.</li></ul><p id=""""><strong id="""">Volunteer with Us</strong></p><p id="""">If you know someone or you would be Interested in volunteering for the Gardens please connect with Jennie our AL/IL Activities Director to set up a time to talk about details. We love having community volunteers to help us with activities or just to spend some one- on - one time with our residents. Email: jdreiling@gardensonquail.com</p><p id=""""><strong id="""">Employee Appreciation: Quail Cash</strong></p><p id="""">We have started an initiative at the Gardens where residents can tip employees for going above and beyond with “Quail Cash“. Employees can then redeem their cash for prizes like a day off paid. If you need quail cash the front desk has extra</p><p id=""""><strong id="""">Gardening Joy</strong></p><p id="""">We have kicked off our summer vegetable planting. We cannot wait to enjoy the fruits of our labor!</p><p id=""""><strong id="""">Welcoming New Residents</strong></p><p id=""""><strong id="""">‍</strong>A warm welcome to our newest members. We're thrilled to have you with us. Martha Lillibridge, Bobby and Ruth Ann Smith, Peggy Hanchey, Barbara Begley, Laura Kroskob, and Diane Flora.</p><p id="""">‍</p>",https://cdn.prod.website-files.com/637e82335616ba47c774e6bc/65e60fef683f660880d9fc24_MarchNewsletter-pdf-ezgif.com-png-to-webp-converter.avif,mariah-ruell,
May 2024 Newsletter,may-2024-newsletter,65e60b49424066470c920d78,66311c360b687a3a2e1b6eb5,false,false,Tue Apr 30 2024 16:28:38 GMT+0000 (Coordinated Universal Time),Thu Jul 17 2025 14:24:07 GMT+0000 (Coordinated Universal Time),Thu Jul 17 2025 15:41:20 GMT+0000 (Coordinated Universal Time),Wed May 01 2024 00:00:00 GMT+0000 (Coordinated Universal Time),https://cdn.prod.website-files.com/637e82335616ba47c774e6bc/66311b2b864191a05b51fa91_May24%20Newsletter.pdf,"<h3 id="""">A Blooming May at Gardens on Quail!</h3><p id="""">Spring has sprung, and we're blossoming with excitement for a fantastic lineup of events this May at Gardens on Quail! With vibrant celebrations, heartfelt gatherings, and plenty of opportunities to connect, we can't wait to share these special moments with you. From our festive Derby Party and Cinco de Mayo celebrations to a delightful Mother’s Day Brunch and an enchanting Tea Party, May promises to be a month filled with joy, laughter, and cherished memories. So, mark your calendars, gather your friends, and let's welcome the warmth and beauty of spring together!</p><h2 id="""">Upcoming Events:</h2><ul id=""""><li id="""">May 4th, 3:00pm: Run for the Roses Derby Party ​</li><li id="""">May 6th, 11:00am: Cinco De Mayo Party ​</li><li id="""">May 12th: Mother’s Day Brunch and Bubbles, 11:00am-1:30pm (Please RSVP by May 8th to Jennie in Activities) ​</li><li id="""">May 14th, 2:00pm: Tea Party “Celebrating Women” ​</li><li id="""">May 17th, 3:00pm: Happy Hour with Elvis ​</li><li id="""">May 23rd, 11:15am: Memory Care Lunch Outing - The Olive Garden ​</li><li id="""">May 27th, 11:30am: Memorial Day BBQ ​</li></ul><h2 id="""">Dementia Support Group: ​</h2><ul id=""""><li id="""">May 14th, 4:00pm: Led by Regional Memory Care Director Marci Gerke. ​ Open to those caring for aging loved ones, especially those with <a href=""/living-options/memory-care"" id="""">dementia</a>, providing support, information, and a welcoming environment for sharing experiences. ​</li></ul><h2 id="""">Welcome New Residents: ​</h2><ul id=""""><li id="""">Roger Hartman</li><li id="""">Della Dickerson</li><li id="""">Errol McGlaughlin</li><li id="""">Gretchen Faulkner</li><li id="""">Ralph Nickel</li><li id="""">Kathleen Parrett</li></ul><h2 id=""""><a href=""/employment"" id="""">Employee of the Month: ​</a></h2><ul id=""""><li id="""">Lisa Garcia: Congratulations to Lisa Garcia, our shining star for May as Employee of the Month! ​ Lisa is the ultimate activities ace, blending bravery, boundless energy, and a heart of gold to create unforgettable moments for our residents. ​</li></ul><h2 id="""">Resident Birthdays:</h2><ul id=""""><li id="""">May 15th: May Yamada ​</li><li id="""">May 19th: Dennis Seabourn ​</li><li id="""">May 24th: Jeannine Hayes ​</li><li id="""">May 27th: Sue McGlaughlin ​</li></ul><h2 id="""">Staff Birthdays:</h2><ul id=""""><li id="""">May 2nd: Kyrstle Mccomb ​</li><li id="""">May 7th: Amy Felperin ​</li><li id="""">May 13th: Nora Mcsherry ​</li><li id="""">May 21st: Delana Wilson ​</li><li id="""">May 26th: Christie Ayre ​</li><li id="""">May 29th: Alexis Myles ​</li></ul><p id="""">‍</p>",https://cdn.prod.website-files.com/637e82335616ba47c774e6bc/66311c326907ae9422f8ee68_May24%20Newsletter-pdf.avif,mariah-ruell,
May 25 Newsletter,may-25-newsletter,65e60b49424066470c920d78,681cc3dacddbdb7973ab7929,false,false,Thu May 08 2025 14:46:50 GMT+0000 (Coordinated Universal Time),Thu Jul 17 2025 14:21:25 GMT+0000 (Coordinated Universal Time),Thu Jul 17 2025 15:41:20 GMT+0000 (Coordinated Universal Time),Thu May 01 2025 00:00:00 GMT+0000 (Coordinated Universal Time),https://cdn.prod.website-files.com/637e82335616ba47c774e6bc/681cc2a50775c5f903882124_May%202025%20Newsletter%20.pdf,"<h1 id="""">Celebrating Community &amp; Spring Connections</h1><h2 id="""">Employee of the Month</h2><p id="""">We're delighted to recognize Fidelia as our Employee of the Month! Fidelia has been an invaluable member of our Quail family for over 10 years. Her unwavering dedication and hard work have always been evident in the way she puts the residents first, ensuring their needs and well-being are met with the utmost care. Fidelia's warm and cheerful presence brings joy and laughter to everyone around her each day. Her positive energy is truly infectious, and it has a remarkable impact on both the staff and residents alike. We are incredibly fortunate to have Fidelia as part of our team, and her contributions are deeply appreciated.</p><h2 id="""">Resident Birthdays</h2><ul id=""""><li id="""">Liz M - May 8th</li><li id="""">Jeannine H - May 24th</li><li id="""">Sue M - May 27th</li></ul><h2 id="""">Special Celebrations</h2><p id="""">Join us for a special celebration on Thursday, May 22nd at 1 pm in the Town Center, where resident Dale Ashton and his wife, Dorothy will be celebrating their 65-year wedding anniversary! Everyone is invited to help commemorate this incredible milestone.</p><h2 id="""">Upcoming Community Events &amp; Calendar Changes</h2><p id=""""><strong>Calendar Update:</strong> In an attempt to give our Wednesday Shopping Outing participants more time to shop, we have moved the Wednesday BINGO game to Tuesday afternoon at 3:00 pm.</p><p id=""""><strong>Western Garden Project:</strong> Thursday, May 8th, we will use the morning to work on our Western Garden beds. We've invited residents to join in, and we will be ordering pizza for whoever comes to help.</p><p id=""""><strong>Mother's Day Celebration:</strong> We will celebrate Mother's Day on Sunday, May 11th by painting and filling flower pots, followed by a delightful Tea Party at 3 pm.</p><p id=""""><strong>EMPOWERME Fitness:</strong> Restorative care will host exercise at 10:30 am every Tuesday in May.</p><p id=""""><strong>Park Trips: </strong>May brings trips to nearby parks to enjoy the beautiful Colorado weather. We will leave every Tuesday morning at 9:30 am &amp; return before 10:30 am exercise.</p><p id=""""><strong>Join us for Happy Hour! </strong>Enjoy tasty treats, refreshing drinks, and a live musical performance! Let's unwind and kick off the weekend together every Friday at 3 PM!</p><h3 id="""">May Performances</h3><ul id=""""><li id="""">May 2nd: Performance by Rick Chinisci and Charlie Duo</li><li id="""">May 9th: Performance by Larry O'Connor on Piano</li><li id="""">May 16th: Encore Performance by Rick Chinisci Duo</li><li id="""">May 23rd: Performance by Dino on Drums</li><li id="""">May 30th: Folk Guitar Performance with Bill Sucke</li></ul><h3 id="""">Plenty of Outings!'</h3><p id="""">We will be taking several lunch, shopping and trips to local parks in May. Here are some of the highlights:</p><ul id=""""><li id="""">Tuesday, May 13th at 9:30 am: Assisted Living will visit Majestic View Park for a relaxing outdoor excursion.</li><li id="""">Thursday, May 15th: Assisted Living will be going to Breadwinners, an Olde Town Arvada favorite.</li><li id="""">Wednesday, May 21st at 11:15 am: By request of one of the residents, Memory Care will be having lunch at Massino's Pizza, another local favorite!</li><li id="""">Wednesday, May 28th at 12:30 pm: Memory Care will visit the Butterfly Pavilion in Broomfield.</li></ul><p id="""">For more information about any of these events or to RSVP, please visit the front desk. We look forward to an exciting month of activities and community connections!</p><p>‍</p>",https://cdn.prod.website-files.com/637e82335616ba47c774e6bc/681cc3605dbcc2ca69bc18f8_thumb.avif,mariah-ruell,https://cdn.prod.website-files.com/637e82335616ba47c774e6bc/681cc3d3a682c18b5e8e0b44_2.avif; https://cdn.prod.website-files.com/637e82335616ba47c774e6bc/681cc3d363a52bd6ddbc5f47_1.avif; https://cdn.prod.website-files.com/637e82335616ba47c774e6bc/681cc3d3d59b7028e92c75e7_3.avif
