Name,Slug,Collection ID,Item ID,Archived,Draft,Created On,Updated On,Published On,Date,PDF,Content,Thumbnail,Author,Gallery
February 25 Newsletter,february-25-newsletter,65e60b49424066470c920d78,67aa30ac61f5a26d6582eaa1,false,false,Mon Feb 10 2025 17:00:28 GMT+0000 (Coordinated Universal Time),Mon Feb 10 2025 17:00:28 GMT+0000 (Coordinated Universal Time),Tue Jun 10 2025 13:56:34 GMT+0000 (Coordinated Universal Time),Sat Feb 01 2025 00:00:00 GMT+0000 (Coordinated Universal Time),https://cdn.prod.website-files.com/637e82335616ba47c774e6bc/67aa2ef6a35c6f2a2ed4455a_February%20Newsletter-compressed.pdf,"<h3 id=""""><strong id="""">Love, Laughter, and Lots of Fun! 🌷</strong></h3><p id="""">February is here, and we’re ready to celebrate love, community, and exciting events all month long at <strong id="""">Gardens on Quail!</strong> From delicious Valentine’s treats to Super Bowl festivities, there’s something for everyone to enjoy.</p><h3 id=""""><strong id="""">🎉 Resident Birthdays – Let’s Celebrate!</strong></h3><p id="""">A very <strong id="""">HAPPY BIRTHDAY</strong> to our wonderful residents! 🎂</p><p id="""">🎈 <strong id="""">Mary W. &amp; Ann M. – February 6</strong><br>🎈 <strong id="""">Tony K. – February 7</strong><br>🎈 <strong id="""">Marlene Z. – February 8</strong></p><p id="""">We hope your day is filled with love, joy, and, of course, cake!</p><h3 id=""""><strong id="""">🌟 Employee of the Month: Anahi</strong></h3><p id="""">This month, we are thrilled to recognize <strong id="""">Anahi</strong> as our <strong id="""">Employee of the Month!</strong> Her kindness, positive energy, and dedication make Gardens on Quail a brighter place for everyone. Whether assisting with care, leading activities, or helping in the dining room, Anahi always goes above and beyond. <strong id="""">Thank you, Anahi, for all that you do!</strong></p><h3 id=""""><strong id="""">🎊 Exciting Events This February!</strong></h3><p id="""">📅 <strong id="""">Men’s Coffee Klatch</strong> ☕ – <strong id="""">Every Tuesday at 9:30 AM | Private Dining Room</strong><br>A great way to start your morning, meet fellow residents, and get to know our new <strong id="""">Activities Director, Conor Smallwood!</strong></p><p id="""">🍷 <strong id="""">Happy Hour – Now with Appetizers!</strong> – <strong id="""">Every Friday at 3 PM</strong><br>Enjoy a refreshing drink, a delicious spread of appetizers, and live entertainment!</p><p id="""">🎤 <strong id="""">Live Music Schedule for Happy Hour:</strong><br>🎸 <strong id="""">February 7th</strong> – Rick Chinisci &amp; Charlie<br>🎶 <strong id="""">February 14th</strong> – Dino<br>🎻 <strong id="""">February 21st</strong> – Kaleidoscope Music Studio<br>🎹 <strong id="""">February 28th</strong> – Piano with Scott Hackler</p><p id="""">❤️ <strong id="""">Valentine’s Tea Party</strong> – <strong id="""">Tuesday, February 11 | 2:30 PM | Town Center</strong><br>Join us for an afternoon of <strong id="""">tea, sweet treats, and delightful company</strong> as we celebrate love and friendship!</p><p id="""">🏈 <strong id="""">Super Bowl Sunday Party!</strong> – <strong id="""">Sunday, February 11</strong><br>Cheer on your favorite team as the <strong id="""">Philadelphia Eagles</strong> take on the <strong id="""">Kansas City Chiefs!</strong> Enjoy a game-day feast, including <strong id="""">mocktails, wings, homemade chips, dips, and more!</strong></p><p id="""">🍕 <strong id="""">Lunch Outing to Randi’s Pizza</strong> – <strong id="""">Thursday, February 13 | 11 AM</strong><br>Let’s head out for a tasty lunch together! <strong id="""">Sign up at the front desk.</strong></p><p id="""">🍝 <strong id="""">Valentine’s Pasta Bar Lunch</strong> – <strong id="""">Friday, February 14 | Dining Room</strong><br>Celebrate love with a <strong id="""">delicious pasta lunch,</strong> made with care by our amazing dining team.</p><p id="""">🍪 <strong id="""">Girl Scout Cookie Sale</strong> – <strong id="""">Friday, February 14 | 2:30 PM | Bistro</strong><br>A local Girl Scout will be selling cookies—so don’t miss your chance to grab your favorite flavors!</p><p id="""">🥯 <strong id="""">Tasty Tuesday: Everything Bagels &amp; Cucumber Bites</strong> – <strong id="""">Tuesday, February 18 | Town Center</strong><br>Enjoy a <strong id="""">savory and refreshing treat</strong> to brighten your week!</p><h3 id="""">‍</h3>",https://cdn.prod.website-files.com/637e82335616ba47c774e6bc/67aa2fd1216a9284e2b26f9e_Page%201.webp,mariah-ruell,https://cdn.prod.website-files.com/637e82335616ba47c774e6bc/67aa30a6f96ec6fbef77873e_1all.webp; https://cdn.prod.website-files.com/637e82335616ba47c774e6bc/67aa30a6422b97cb7f1ac09d_2all.webp; https://cdn.prod.website-files.com/637e82335616ba47c774e6bc/67aa30a674787a9771a7e512_3all.webp
January 2024 Newsletter,january-2024-newsletter,65e60b49424066470c920d78,65e73bb06ae809f67fda9aca,false,false,Tue Mar 05 2024 15:35:12 GMT+0000 (Coordinated Universal Time),Thu Jul 17 2025 14:24:47 GMT+0000 (Coordinated Universal Time),Thu Jul 17 2025 15:41:20 GMT+0000 (Coordinated Universal Time),Mon Jan 01 2024 00:00:00 GMT+0000 (Coordinated Universal Time),https://cdn.prod.website-files.com/637e82335616ba47c774e6bc/65e73a5e06b15823e837b4c3_January%20%20Newsletter%20(1).pdf,"<p id=""""><strong id="""">We are immensely grateful for your spirited participation during the holiday season, making it memorable at Gardens on Quail. We hope your time was filled with joy and love. </strong></p><p id=""""><strong id="""">Wishing you all a prosperous 2024!</strong></p><p id=""""><strong id="""">Special Thanks &amp; Happy New Year!</strong>We are immensely grateful for your spirited participation during the holiday season, making it memorable at The Gardens on Quail. We hope your time was filled with joy and love. Wishing you all a prosperous 2024!</p><p id=""""><strong id="""">Upcoming Events:</strong></p><ul id=""""><li id="""">January 8:Elvis Performance, 3:00 pm</li><li id="""">Podiatrist for ancillary services, 9:30 am - 1:00 pm</li><li id="""">January 10: Dallas Make-up Christmas Meal, 12:00 pm</li><li id="""">January 11: New Resident Lunch, 12:00 pm</li></ul><p id=""""><strong id="""">Resident Birthdays:</strong></p><ul id=""""><li id="""">January 10: Phillip Cedillo</li><li id="""">January 12: Arlene Kracl and Gerda Gyori</li></ul><p id=""""><strong id="""">Staff Birthdays:</strong></p><ul id=""""><li id="""">January 2: Alicia Sanchez and Amila Bico</li><li id="""">January 7: Alicia A Sanchez</li><li id="""">January 15: Maria Gallegos</li><li id="""">January 18: Sara Elkins</li><li id="""">January 26: Natalia Alvarez</li></ul><p id=""""><strong id="""">MLK Service Project Donations:</strong></p><p id=""""><strong id="""">‍</strong>Join us in our community service project on MLK Day, January 15. We're collecting donations to support those experiencing homelessness. We're in need of items like socks, toothbrushes and paste, deodorant, hats, gloves, hand warmers, and granola bars. Please bring your contributions to the front desk by January 12.</p><p id=""""><strong id="""">Welcome New Residents:</strong></p><ul id=""""><li id="""">Paula Neumann</li><li id="""">Lou Svoboda</li><li id="""">Sharlene Leslie</li><li id="""">Ilhamy Iskander</li></ul><p id=""""><strong id="""">A Heartfelt Thank You:</strong></p><p id=""""><strong id="""">‍</strong>Our deepest appreciation goes out to everyone who supported the Crisalida Inc. Adopt A Family Giving Tree. Your generosity made a significant difference, providing seven families with a joyful Christmas, complete with toys and a festive meal.</p><p id="""">‍</p>",https://cdn.prod.website-files.com/637e82335616ba47c774e6bc/65e73a61df64f01b053076f3_JanuaryNewsletter1-pdf-ezgif.com-resize.avif,mariah-ruell,
January 25 Newsletter,january-25-newsletter,65e60b49424066470c920d78,67730eee0341c194683dd919,false,false,Mon Dec 30 2024 21:21:50 GMT+0000 (Coordinated Universal Time),Mon Dec 30 2024 21:41:51 GMT+0000 (Coordinated Universal Time),Tue Jun 10 2025 13:56:34 GMT+0000 (Coordinated Universal Time),Wed Jan 01 2025 00:00:00 GMT+0000 (Coordinated Universal Time),https://cdn.prod.website-files.com/637e82335616ba47c774e6bc/677310786e79a4569b32cb7f_January%20Newsletter%20(2)-compressed.pdf,"<p id="""">As we step into 2025, Gardens on Quail is buzzing with activities to keep our community vibrant, engaged, and connected! From live music to creative workshops, there’s something for everyone to enjoy. Here’s a sneak peek into what’s happening this month:</p><h4 id="""">🎶 <strong id="""">A Night with the King – January 8th at 6:00 PM</strong></h4><p id="""">Get ready to rock ‘n’ roll! Join us for an electrifying performance by Elvis himself (or the next best thing). Gather your friends and neighbors for an evening of music, dancing, and nostalgia that’ll have you singing along all night long.</p><h4 id="""">🎨 <strong id="""">Arts &amp; Crafts – Mondays at 1:30 PM</strong></h4><p id="""">Channel your creativity and build meaningful connections! Every Monday, join us for fun arts and crafts sessions that let you express yourself while bonding with your neighbors. Let’s make something beautiful together.</p><h4 id="""">☕ <strong id="""">Coffee &amp; Conversation – Tuesdays at 9:30 AM</strong></h4><p id="""">Start your Tuesdays with a warm cup of coffee and even warmer conversations. Whether it’s catching up with friends or making new ones, this is the perfect way to kick off your day.</p><h4 id="""">♠️ <strong id="""">Game Nights – Tuesdays at 6:15 PM</strong></h4><p id="""">Looking for some friendly competition? Swing by Cinnamon for self-led card and board games. It’s a great way to relax, unwind, and enjoy quality time with your neighbors.</p><h4 id="""">🤔 <strong id="""">Wacky Word Games – Wednesdays at 11:00 AM</strong></h4><p id="""">Laughter is guaranteed at our Wacky Word Games! Get creative, test your wits, and have a blast with your friends. Don’t miss this midweek pick-me-up!</p><h4 id="""">🏋️ <strong id="""">EmpowerME Wellness Discussions – Thursdays at 11:00 AM (Starting January 9th)</strong></h4><p id="""">Let’s talk health, fitness, and wellness! Join EmpowerME for insightful discussions that’ll inspire you to live your best life. A healthier you starts here.</p><h4 id="""">🌺 <strong id="""">Flower Arranging – Fridays at 11:15 AM</strong></h4><p id="""">Brighten up our facility with your artistic touch! Join us to create stunning floral centerpieces that add a touch of elegance to our community.</p><h4 id="""">💪 <strong id="""">Saturday Workouts – Saturdays at 10:00 AM</strong></h4><p id="""">Let’s kickstart the weekend with some fun and fitness! Join our friendly exercise classes to stay active, energized, and ready for whatever the weekend brings.</p><h3 id=""""><strong id="""">Celebrate with Us!</strong></h3><p id="""">Raise a toast to Debbie, our January Employee of the Month! Her positivity, professionalism, and dedication make her an invaluable part of our team. Congratulations, Debbie!</p><p id="""">Let’s make 2025 a year to remember. Check your calendar for more<a href=""/our-community/activities""> exciting activities</a> – there’s something for everyone, and we’d love to see you there! Together, let’s embrace the new year with joy, laughter, and plenty of cherished moments.</p><p>‍</p>",https://cdn.prod.website-files.com/637e82335616ba47c774e6bc/677310c983e90917f57d12c1_Page%201.webp,mariah-ruell,https://cdn.prod.website-files.com/637e82335616ba47c774e6bc/677312150341c1946840d636_1.webp; https://cdn.prod.website-files.com/637e82335616ba47c774e6bc/67731215e0451f713b6696de_2.webp; https://cdn.prod.website-files.com/637e82335616ba47c774e6bc/67731215b4ecaf963da2b7d5_3.webp; https://cdn.prod.website-files.com/637e82335616ba47c774e6bc/67731215582a68396e46c837_4.webp
July 2024 Newsletter,july-2024-newsletter,65e60b49424066470c920d78,667c3eabbfe7fed73868154d,false,false,Wed Jun 26 2024 16:15:39 GMT+0000 (Coordinated Universal Time),Thu Jul 17 2025 14:23:15 GMT+0000 (Coordinated Universal Time),Thu Jul 17 2025 15:41:20 GMT+0000 (Coordinated Universal Time),Mon Jul 01 2024 00:00:00 GMT+0000 (Coordinated Universal Time),https://cdn.prod.website-files.com/637e82335616ba47c774e6bc/667c3c8b219b9df821f7f0cd_July%20Newsletter.pdf,"<p id="""">This month is packed with exciting events, special celebrations, and heartwarming welcomes at Gardens on Quail. Dive into the highlights and join us in making this summer memorable.</p><h3 id=""""><strong id="""">Employee of the Month</strong></h3><p id=""""><strong id="""">‍</strong>Congratulations to Rickden Tsering, our Employee of the Month for July! Rickden's humble kindness and readiness to help wherever needed make him an invaluable member of our community. Our residents and staff wholeheartedly appreciate you, Rickden!</p><h3 id=""""><strong id="""">Upcoming Events</strong>‍</h3><p id=""""><strong id="""">Patriotic Show with Dino</strong></p><p id="""">Date: July 3rd<br>Time: 2:00 pm<br>Celebrate the spirit of Independence Day with a patriotic show by Dino.<br>‍</p><p id=""""><strong id="""">Fourth of July Parade</strong></p><p id="""">Date: July 4th<br>Time: 10:00 am<br>Join us for a festive Fourth of July parade.<br>‍</p><p id=""""><strong id="""">Summer Tea Party</strong></p><p id="""">Date: July 10th<br>Time: 2:00 pm<br>Enjoy a delightful afternoon tea party to celebrate summer.<br>‍</p><p id=""""><strong id="""">Meet and Greet with EmpowerMe</strong></p><p id="""">Date: July 11th<br>Time: 1:30 pm<br>Get to know the EmpowerMe team during this casual meet and greet.<br>‍</p><p id=""""><strong id="""">Summer Luau Fundraiser</strong></p><p id="""">Date: July 26th<br>Time: 1:30 pm - 2:00 pm<br>Mark your calendars for our second annual Alzheimer's Luau event. Enjoy a Hawaiian BBQ and a captivating performance by Tehani's Hula Colorado. Tickets are $35 for guests, with all proceeds benefiting our Alzheimer's Association Fundraiser. Kindly RSVP by July 16th.<br>‍</p><p id=""""><strong id="""">July Birthdays Celebration</strong></p><p id="""">Date: July 31st<br>Time: 3:00 pm<br>Join us in celebrating the birthdays of our wonderful residents.<br>‍</p><h3 id=""""><strong id="""">Welcome New Residents</strong>‍</h3><p id="""">A warm welcome to our newest community members: Carmen Bednarz, Mary Ann Thompson, and Emilie Arnold. We are thrilled to have you with us!</p><h3 id=""""><strong id="""">Warm Welcome to Our New Executive Director and Nurse</strong>‍</h3><p id="""">We are excited to welcome Mariah Ruell as our new Executive Director and Rick Wathen as our new Director of Health and Wellness. Your presence will surely enhance the Gardens on Quail community even further!</p><h3 id=""""><strong id="""">Navigating the Journey of Dementia</strong>‍</h3><p id="""">We are offering a class for families, friends, or residents to develop a better understanding of dementia, improve communication, and learn effective approaches to caring for loved ones. Classes are held on Tuesdays from 6 pm to 7:30 pm, starting June 25th and running for five weeks. Please RSVP to Marci Gerke at mgerke@stagesenior.com as we will limit this class to 20 people.</p><p id=""""><strong id="""">Dementia Support Group<br></strong>Date: July 9th<br>Time: 4:00 pm<br>Led by Regional Memory Care Director Marci Gerke, this group provides support, information, and a welcoming environment for those caring for loved ones with dementia.</p><p id="""">Join us for a summer full of joy, community spirit, and heartfelt connections at Gardens on Quail!</p><p id="""">‍</p>",https://cdn.prod.website-files.com/637e82335616ba47c774e6bc/667c3d09e7d3500183317dd0_july.avif,mariah-ruell,https://cdn.prod.website-files.com/637e82335616ba47c774e6bc/667c3e287f40ed5882e5afbf_4-ezgif.com-crop.avif; https://cdn.prod.website-files.com/637e82335616ba47c774e6bc/667c3e288618315fd88d09f0_3-ezgif.com-crop.avif; https://cdn.prod.website-files.com/637e82335616ba47c774e6bc/667c3e28980d623acf12cb9e_2-ezgif.com-crop.avif; https://cdn.prod.website-files.com/637e82335616ba47c774e6bc/667c3e28fe3d58aa6389a5d4_1-ezgif.com-crop.avif
July 25 Newsletter,july-25-n,65e60b49424066470c920d78,6865681c4164bbf8a1487506,false,false,Wed Jul 02 2025 17:10:52 GMT+0000 (Coordinated Universal Time),Thu Jul 17 2025 14:20:27 GMT+0000 (Coordinated Universal Time),Thu Jul 17 2025 15:41:20 GMT+0000 (Coordinated Universal Time),Tue Jul 01 2025 00:00:00 GMT+0000 (Coordinated Universal Time),https://cdn.prod.website-files.com/637e82335616ba47c774e6bc/6865682df892ae086a9855e7_July%202025%20Newsletter%20.pdf,"<p id="""">Fireworks aren’t the only thing lighting up our skies this month—July at Gardens on Quail is positively sparkling with celebrations, adventures, and shared moments of joy! From patriotic parades to sock-hop shimmies, there’s something on the calendar for every resident, family member, and friend to enjoy.</p><h4 id="""">Kick-off: A Star-Spangled Friday (July 4)</h4><p id="""">We’ll salute the red, white, and blue with a <em id="""">wheelchair &amp; walker car-wash</em>, a decorating station, and our colorful <strong id="""">Wheelchair Parade</strong> rolling out at <strong id="""">2 p.m.</strong> Bring your flags, cheer on the marchers, and stay for a front-row seat to Rick Chinisci &amp; Charlie Duo during Happy Hour at 3 p.m.</p><h4 id="""">Carnival Weekend Extravaganza (Saturday, July 5)</h4><p id="""">Step right up for midway-style games, bubble socials, face painting, and classic fair treats. Laughter is guaranteed, prizes are plentiful, and memories are waiting to be made.</p><h4 id="""">Feathered Friends &amp; Scenic Drives</h4><ul id=""""><li><strong id="""">July 8</strong> – We officially welcome new residents to our <strong id="""">Aviary</strong>—watch as they stretch their wings and make themselves at home.</li><li><strong id="""">July 9</strong> – Buckle up for a summertime <strong id="""">scenic drive</strong> through the foothills. Picture windows down, mountain breezes in your hair, and that unmistakable Colorado view.</li><li><strong id="""">July 23</strong> – Butterflies beckon! Our trip to the <strong id="""">Butterfly Pavilion</strong> promises fluttering beauty, soft landings, and maybe a caterpillar selfie or two.</li></ul><h4 id="""">Rock Around the Clock: 1950s Sock Hop &amp; Movie Matinee (July 14)</h4><p id="""">Pull on your poodle skirts and saddle shoes—our retro diner transforms into a <strong id="""">rock-’n’-roll dance floor at 1:30 p.m.</strong> Malts, shakes, and jukebox jams included. Finish the afternoon with a “Dirty Dancing” matinee (because nobody puts Quail in a corner).</p><h4 id="""">Creative Corners</h4><ul id=""""><li><strong id="""">Rise &amp; Shine Mondays</strong> – Start every week with meditation, garden play, or coffee with neighbors.</li><li><strong id="""">Tasty Tuesdays</strong> – Whip up Muddy Buddies (July 15) and Cajun Nut Mix (July 29).</li><li><strong id="""">Creative Music Workshop (July 18, 1:30 p.m.)</strong> – Jam with Conor, Chef Bob, and fellow music lovers. Instruments provided—or bring your own!</li></ul><h4 id="""">Aloha, August-Eve! Hawaiian Luau (July 30)</h4><p id="""">Glowstick exercise at dawn, a tropical buffet at 11 a.m., and authentic Tehani Hula Dancers at 1:30 p.m. Cap it off with our own hula contest and Hawaiian storytelling at 2:30 p.m. Aloha attire encouraged!</p><h3 id="""">Community Spotlight</h3><p id=""""><strong id="""">Employee of the Month: Emily Stevens-Newlon</strong><br>Since April, Emily’s bright smile has greeted everyone at our front desk. Whether she’s helping a resident, welcoming a guest, or supporting a teammate, Emily’s warmth sets the tone for our community. Congratulations, Emily—your excellence shines through daily!</p><h4 id="""">Resident &amp; Team Birthdays</h4><p id="""">Join us in sending heartfelt wishes to Julys’ honorees: Emile A. (3rd), Paula N. (9th), Emily Stevens-Newlon (10th), Frene Boyet (13th), Jenelyn Pinney (13th), Jose Guerrero (21st), Barabara Vinzant (22nd), and Suzanne Brodeur (31st).</p><p id="""">Here’s to fireworks of friendship, sparks of creativity, and sunshine-filled days at Gardens on Quail!</p><p>‍</p>",https://cdn.prod.website-files.com/637e82335616ba47c774e6bc/68656a4dba8750e751577697_July%202025%20Newsletter.webp,mariah-ruell,https://cdn.prod.website-files.com/637e82335616ba47c774e6bc/68656b146e937b844465c177_gallery1.webp; https://cdn.prod.website-files.com/637e82335616ba47c774e6bc/68656b7cf4fe7af9d3e95ee8_gallery2.webp; https://cdn.prod.website-files.com/637e82335616ba47c774e6bc/68656b7f26e807bf52e70dd1_gallery3.webp
